<!ELEMENT factura (informacion, cliente, empresa, productos, totales, comentarios)>

<!ELEMENT informacion (fecha_factura, numero_factura, fecha_vencimiento)>
<!ELEMENT fecha_factura (#PCDATA)>
<!ELEMENT numero_factura (#PCDATA)>
<!ELEMENT fecha_vencimiento (#PCDATA)>

<!ELEMENT cliente (nombre, direccion, NIF, CP, ciudad, email)>
<!ELEMENT nombre (#PCDATA)>
<!ELEMENT direccion (#PCDATA)>
<!ELEMENT NIF (#PCDATA)>
<!ELEMENT CP (#PCDATA)>
<!ELEMENT ciudad (#PCDATA)>
<!ELEMENT email (#PCDATA)>

<!ELEMENT empresa (nombre, direccion, CIF, CP, ciudad, email)>
<!ELEMENT CIF (#PCDATA)>

<!ELEMENT productos (producto+)>
<!-- Uso de `+` porque debe haber al menos un producto en cada factura -->

<!ELEMENT producto (descripcion, unidades, precio_unitario, precio)>
<!ELEMENT descripcion (#PCDATA)>
<!ELEMENT unidades (#PCDATA)>
<!ELEMENT precio_unitario (#PCDATA)>
<!ATTLIST precio_unitario
    moneda CDATA #REQUIRED>
<!-- El atributo `moneda` es #REQUIRED para especificar la moneda en el precio unitario -->

<!ELEMENT precio (#PCDATA)>
<!ATTLIST precio
    moneda CDATA #REQUIRED>
<!-- El atributo `moneda` es #REQUIRED para especificar la moneda en el precio total del producto -->

<!ELEMENT totales (base_imponible, IVA, IRPF, total)>
<!ELEMENT base_imponible (#PCDATA)>
<!ATTLIST base_imponible
    moneda CDATA #REQUIRED>

<!ELEMENT IVA (#PCDATA)>
<!ATTLIST IVA
    porcentaje CDATA #REQUIRED
    moneda CDATA #REQUIRED>

<!ELEMENT IRPF (#PCDATA)>
<!ATTLIST IRPF
    porcentaje CDATA #REQUIRED
    moneda CDATA #REQUIRED>

<!ELEMENT total (#PCDATA)>
<!ATTLIST total
    moneda CDATA #REQUIRED>

<!ELEMENT comentarios (pago_por_transferencia)>
<!ELEMENT pago_por_transferencia (#PCDATA)>
